ID,명칭,우편번호,관리자,전화번호,주소,위도,경도,개요,문의 및 안내,규모,좌석수,주차 시설,어린이놀이방,개업일,영업시간,쉬는날,대표메뉴,취급메뉴,할인정보,금연/흡연,신용카드정보,포장가능,예약안내,상세정보,인허가번호
2374199,나운터횟집,63596,나운터횟집,064-763-2237,제주특별자치도 서귀포시 칠십리로 42 ,33.2409484408,126.5614062527,중문 관광단지에서 차량으로 10분 거리 내 위치한 횟집이다.각종 활어회를 신선하게 먹을 수 있고  다른 음식점과 달리 부채새우라는 음식을 보다 맛있게 먹을 수 있는 곳이다.,064-763-2237,,,가능,0,,12:00 ~ 22:00,연중무휴,구문쟁이코스,구문쟁이코스 / 나운터스페샬모듬회소 / 참돔회코스 외,,모두 금연석,가능,가능,"전화 예약 문의 (064-763-2237, 064-762-8198)","화장실:남녀개별 업소내 위치
",19970631100
2791306,애월빵공장앤카페,63034,,,제주특별자치도 제주시 애월읍 금성5길 42-15 ,33.4483158609,126.3015741601,애월빵공장앤카페는 최고의 쉐프들이 엄선된 재료만을 사용하여 최신 설비와 오븐으로 4시간 이내에 구운 빵을 판매하여 신선하고 맛있는 빵과 음료를 즐길 수 있는 곳이다. 특히 현무암쌀빵  고구마빵  한라봉모히또  에멜랄드비치에이드는 이곳 시그니처 메뉴이다. 매장에서 사용한 컵은 재활용이 가능한 친환경 리유저블컵으로 사용 후 가지고 가서 재사용이 가능하다. 곽지해수욕장의 에메랄드빛 바다 뷰와 제주다운 맛과 멋을 만끽할 수 있는 여유로운 공간에서 여행 중 잠시 힐링 타임을 가져보자.,064-743-2015 / 0507-1351-5961,,,주차가능,0,,09:00 - 20:00 (라스트오더 19:30),,"현무암 쌀 빵, 에멜랄드 비치에이드","제주 감귤 주스, 제주 당근 주스, 그린티 라떼 등",,,가능,가능,,"화장실:가능
부대시설:단체석  주차장  화장실
",20240956077
2811459,훈데르트윈즈,63365,,,제주특별자치도 제주시 우도해안길 32-2 ,33.4921103615,126.9552580701,훈데르트윈즈는 성산일출봉을 화룡점정으로 시시각각 변하는 우도의 바다를 두 눈에 담을 수 있는 우도 최고의 뷰 카페이다. 전면 통창으로 이루어져 있어 어느 자리에 앉아도 탁 트인 바다뷰를 감상할 수 있다. 카페 내부에선 훈데르트바서 오리지널 굿즈샵도 운영하고 있다.,064-766-6020,,,주차 가능,0,,09:30 ~ 18:00,연중무휴,땅콩소프트아이스크림 / 땅콩크림라떼,땅콩 빙수 / 우도 선라이즈 / 땅콩캬라멜 우도넛 외,,,,가능,,,20220898208
2830204,무로이,63523,,,제주특별자치도 서귀포시 동광본동로 21 ,33.3078014028,126.3368020179,"무로이는 ‘안개가 몹시 짙게 끼거나  오랫동안 끼는’라는 의미이다. 블랙톤의 외관은 마치 미술관에 온듯한 느낌을 준다. 카페로 들어서면 초록색의 정원을 담은 공간이 나오며  내부는 노출콘크리트 벽으로 공간을 구분하고 전통적인 항아리 장식도 오묘한 조화를 이룬다. 모든 좌석이 창을 향해 나 있고  창밖으로 아름다운 정원을 감상할 수 있다. 
무로이의 시그니처 메뉴는 부드러운 시그니처 크림라떼  시그니처 크림과 콜드브루의 조합인 크림브루 등의 음료가 있다. 또 미니 항아리 안에 티라미수가 담겨 있는 항아리 티라미수  부드러운 크림치즈를 넣어 만든 시그니처 레어치즈케이크 등의 이색적인 디저트도 있다.",0507-1412-0008,,,가능(약 20대),0,,10:00~19:00<br>라스트오더 18:00,연중무휴,크림라떼 (헤이즐넛/블루베리),크림라떼 (헤이즐넛/블루베리) / 크림브루 (아인슈페너) / 항아리 티라미수 / 무로이 외,,,가능,가능,,"화장실:있음(남/녀 구분)
부대시설:세미나실

",20210624779
2830228,도렐 제주 본점,63640,,,제주특별자치도 서귀포시 동류암로 20 플레이스호텔 플레이스 내 LOVE동,33.4496450053,126.9180400527,서귀포 성산일출봉 근처 숙소인 플레이스 캠프에 속해있는 카페이다. 호텔 자체도 인기가 좋지만  도렐은 커피 맛으로 소문이 나서 투숙객이 아닌 손님들도 많이 찾는다. 다양한 베이커리가 준비되어 있다. 시그니처인 너티클라우드는 땅콩 크림 우유가 들어간 커피로 약간의 호불호가 갈리지만 전체적으로 커피 맛이 좋아 언제나 손님이 많다. 플레이스 캠프 제주 투숙객은 할인을 받을 수 있다.,064-766-3008,,,약 100대 (플레이스캠프 제주의 주차장 공유),0,,08:30~20:00,연중무휴,너티클라우드,쑥하리 / 체리조 / 옐로 페즈 / 티 / 베이커리 외,,,,,,,20170631157
2830485,권가칼국수,63303,,,제주특별자치도 제주시 화삼북로 38 1층,33.5171098365,126.5769319952,권가칼국수는 제주 토종닭을 얇게 포 뜨고 이를 육수에 야채와 함께 살짝 익혀 먹는 닭 샤브샤브 코스요리를 제공한다. 녹두죽-닭 샤부샤부-토종닭백숙-조개칼국수 순서로 음식이 나오는 보양식 한 코스이다. 닭고기를 접시가 비칠 정도로 얇게 써는 요리사의 솜씨가 좋고  토종닭의 쫄깃함과 부드러움을 동시에 느낄 수 있도록 삶아내는 노하우도 훌륭하다. 닭 샤부샤부는 제주에서도 교래리 특구에 가야 맛볼 수 있었는데 권가칼국수는 공항 근처 제주 시내에 있어 접근성도 좋다. 아파트 단지 안에 있어 가족 단위 손님이 많으며 점심시간에는 칼국수와 파전 등 식사만 제공  저녁시간에는 토종닭코스요리만 제공한다.,064-803-0002,,,가능(건물 뒷편 4대),0,,11:00~22:00<br>브레이크타임 15:00~17:00<br>라스트오더 20:30,매주 일요일,권가토종닭샤브세트,권가토종닭샤브세트 / 닭칼국수 / 동죽칼국수 / 비빔칼국수 외,,,가능,,가능(전화 문의),"화장실:있음(남/녀 구분)
",20210622736
2833308,타쿠마 스시,63641,,,제주특별자치도 서귀포시 섭지코지로 15 ,33.4390739586,126.9185069225,섭지코지 근처에 있는 타쿠마는 컨테이너 스시집이다. 날마다 신선한 회를 선별하여 제공하는 모둠 초밥과 모둠 사시미는 매일 구성이 다르다. 참치는 모두 참다랑어만 사용하며 에피타이저로 제공되는 흑돼지 곤약 무침도 이곳만의 고유 메뉴이다. 일식 이외에 제주산 식재료를 이용한 포케와 파스타  슈토아에를 맛볼 수 있고  우동  소바  구이  덮밥 등의 메뉴도 있다. 회를 못 먹는 사람들이 주로 택하는 빨간 우동의 경우  생선 뼈를 우린 진한 육수에 꽃게  전복  딱새우 등 해산물이 푸짐하게 들어가 별미이다.,064-783-4894,,,"있음 / 건물 앞 소형 약 5대, 근처 전용 소형 약 5대",0,,11:30~22:00,격주 화요일,타쿠마 특 스시,"모둠 사시미, 탁마 초밥, 일출봉 슈토아에, 포케, 광치기 해초 냉 파스타",,,,,,,20150631049
2836462,사계생활,63528,,,제주특별자치도 서귀포시 산방로 380 ,33.2315647433,126.2963294489,"카페 사계생활은 농협은행으로 쓰이던 공간을 리모델링하였으며 집기와 금고 등의 시설물을 그대로 카페 시설로 사용하고 있다. 안쪽 사무공간이었던 자리는 소품 샵으로 활용하고 있으며 근처 여행지도  가볼 만한 곳 안내 등 여행자를 위한 정보 제공도 하고 있다. 사계생활만의 고유한 메뉴명을 사용하고 있는데 카페모카는 돌담  크림라테는 곶  카푸치노는 산방산 등이다. 근처 여행지로 산방산  사계해안 등을 둘러볼 수 있다.   
※ 반려동물 동반 가능(목줄  배변봉투 지참)",064-792-3803,,,가능,0,,주중 10:00~18:00<br>주말 10:00~17:00,매주 일요일,드립커피 / 제주 레드 빈 라떼,드립커피 / 제주 레드 빈 라떼 / 제주 당근 쥬스 / 제주 풋귤에이드 등,,,,,,"화장실:남녀 구분
",20200624109
2836825,카페루시아 본점,63533,,,제주특별자치도 서귀포시 난드르로 49-17 ,33.2346182342,126.363240242,"카페루시아는 올레길 8코스 대평포구 근처에 있다. 카페 내  외부 공간에 테이블  루프탑이 있으며 이 자리에서 박수기정을 가까이 조망할 수 있다. 정면으로 송악산과 형제섬이 보이고 날씨가 좋을 때는 가파도와 마라도까지 보이는 전망이 좋은 해변 카페이다. 잔디밭  꽃밭이 잘 가꾸어져 있고 반려견 동반이 가능하며 노을이 아름답기로도 유명하다. 골목여행하기 좋은 대평리 안에 있으며 근처 여행지로는 논짓물  화순금모래해수욕장  중문색달해변이 있다. 
※ 반려동물 동반 가능(목줄  배변봉투 지참)",064-738-8879,,,있음 / 주차요금 무료,0,,09:30 ~ 21:00,연중무휴,아메리카노,"에스프레소, 제주 감귤차, 젤라또, 초코라테, 소금빵, 케이크류",,,,가능,,"화장실:남녀 구분
",20210624579
2836873,미스틱3도,63079,,,제주특별자치도 제주시 1100로 2894-49 1층,33.4500241681,126.487380188,미스틱3도는 제주시 1 100도로 초입 신비의 도로 옆에 있다. 한라산이 보이는 가드닝 카페로 겨울 동백  봄 벚꽃  가을 핑크뮬리 등 다양한 꽃과 나무를 감상할 수 있다. 계절별로 시즌 음료를 선보이며  SNS를 통해 정원 곳곳의 다양한 포토존을 적극적으로 홍보하고 있다. 반려견 동반할 수 있고  정원 한쪽에 토끼  포니  미니피그 등을 키워 먹이 주기 체험도 할 수 있다.,064-743-2905,,,있음 / 주차요금 무료,0,,08:30~19:00 (라스트오더 18:30),연중무휴,녹차 새순 한라봉 아이스티,한라봉 에이드 / 수제 그래놀라 요거트 / 한라봉차 / 아메리카노 / 베이커리 외,,,,,,,20140627471
2836964,외도339,63068,,,제주특별자치도 제주시 일주서로 7345 ,33.4937712193,126.4317173715,"외도339는 제주공항 근처 외도이동 바닷가에 있다. 오이디오339로 등록된 카페이지만 포털이나 여행자는 외도339로 부르기 때문에 찾아갈 때는 간판에 OEDO339라 쓰여 있는지 확인하는 것이 좋다. 커피  음료를 비롯해 다양한 빵 종류가 있으며 1  2층 좌석이 넓고  외부 공간에는 잔디  모래밭 등 사진 찍을 곳도 많다. 반려견 놀이터도 있어 주민들의 산책코스로 애용되고 있다. 주변 여행지로 알작지  이호테우해수욕장 등이 있다.
※ 반려동물 동반 가능(리드줄 착용)   반려견 놀이터 있음  실내 입장 시 전용 가방 지참",064-748-0339,,,있음 / 소형 약 40대,0,,09:00 ~ 22:00 (21:30 라스트오더),연중무휴,"삼구 시나몬 크림, 삼구 아몬드 크림",아메리카노/바닐라 빈 라떼/청귤차/제주 말차 라떼/수제 청귤에이드/한라봉감귤 착즙주스,,,가능,가능,예약 가능,,20190621458
2836976,제주돔베고기집,63098,,,제주특별자치도 제주시 월랑로4길 6 ,33.4879031676,126.4784939918,제주돔베고기집은 제주공항 근처 제주시 노형동 시내 중심에 있다. 돔베는 제주어 도마를 뜻하며 도마 위에 나오는 수육을 돔베고기라 한다. 제주돔베고깃집에서는 제주 암퇘지만 사용하며 김치는 과일로 양념하여 만든다. 주문할 때 살코기 또는 비계 부위를 선택할 수 있으며  돔베고기와 김치  전복  한치와 홍어회무침이 한 세트인 돔베한상 또는 김치돔베보쌈을 주문하면 순두부나 몸국이 함께 나온다.,064-713-9949,,,있음 / 소형 약 40대,0,,12:00~23:00,일요일,돔베한상세트,김치돔베보쌈 / 멸고국수 / 비빔국수 외,,,,가능,,,20080627142
2837033,협재해물라면오빠네,63012,,,제주특별자치도 제주시 한림로 475 바다방면 1층,33.4020118583,126.2510184831,"오빠네해물라면은 여행자 사이에서 '협재해물라면오빠네'로 불리며 한림항 근처 옹포리 포구에 있다. 비양도를 보며 취식할 수 있으며 야외 공간의 테이블에서는 반려동물 동반도 할 수 있다. 수프나 캡사이신을 사용하지 않고 직접 개발한 숙성된 소스로 국물맛을 내며 멋진 바다 뷰  노을 뷰와 함께 기념사진 찍기 좋은 집이다. 근처 여행지로 한림항  비양도  금능해수욕장  협재해수욕장이 있다. 
※ 반려동물 동반 가능(케이지 사용 필수  야외 취사 시 리드줄 필수)",064-796-2776,,,가능,0,,09:00~19:00,연중무휴,문어 해물라면,문어 해물라면 / 고기라면 / 전북치즈밥 / 고기덮밥 등,,,,,,,20190621047
2837068,카페나모나모베이커리,63112,,,제주특별자치도 제주시 도두봉6길 4 ,33.5089340685,126.4719635282,카페나모나모베이커리는 제주 용두암 해안도로 무지개 해안도로와 도두봉(도들오름) 앞에 있다. 아침 일찍 오픈하는 베이커리 카페로 근처에 숙박하는 여행자들이 간단한 아침 식사를 해결하기 위해 이용한다. 2층에서는 제주 북쪽 바다와 무지개 해안도로  도두봉(도들오름)을 볼 수 있으며  루프탑으로 올라가면 한라산이 보인다. 직접 로스팅한 원두를 사용하며  다양한 빵이 있고  대형 주차장과 긴 영업시간  공항 근처 위치 등의 이유로 도민과 여행자가 골고루 많이 찾는다.,064-713-7782,,,있음 / 건물 뒤편 소형 약 50대,0,,10:00~22:00 (라스트오더 21:30 ),연중무휴,로맨틱 선셋,"쑥 라테, 콩가루 집안, 아인슈페너, 아메리카노, 치아바타, 크루아상, 케이크류 등",,,가능,가능,,"화장실:남녀 구분
",20200620019
2837142,동광메밀짬뽕,63524,,,제주특별자치도 서귀포시 신화역사로 581 ,33.3105401917,126.3497119467,동광메밀짬뽕은 제주특별자치도 서귀포시 안덕면에 있는 짬뽕 전문점이다. 버스를 이용할 경우 성교동에서 내리면 가깝다. 대표 메뉴는 짬뽕과 짜장인데 밀가루 대신 제주에서 이모작을 하는 메밀을 사용하기 때문에 식감이 독특하고 소화가 잘된다. 짬뽕의 경우 매운 짬뽕과 하얀 짬뽕  해물짬뽕으로 나뉘고 탕수육은 찹쌀로 튀긴 그릇에 담겨 나와 그릇까지 소스에 적셔서 먹을 수 있다. 짬뽕과 짜장 외에도 냉우동과 해물누룽지탕  깐풍기  팔보채가 있다. 관광객은 물론이고 현지인들도 인정하는 소문난 맛집이지만 오전 11시에 문을 열고 오후 5시까지만 영업한다. 근처 여행지로 신화 역사공원  오설록 티 뮤지엄  카멜리아힐 등이 있다.,064-792-0887,,,가능,0,,11:00~17:00,"매주 수요일, 목요일",메밀짬뽕,메밀짜장면 / 메밀해물짬뽕 / 탕수육미니 / 메밀굴짬뽕 / 메밀하얀짬뽕 등,,,,,,"부대시설:무선인터넷 
",20170632073
2837164,브라보비치,63638,,,제주특별자치도 서귀포시 해맞이해안로 2614 ,33.4775445568,126.9091512905,"브라보비치는 성산일출봉과 우도가 보이는 제주 동쪽에 위치한 디저트 카페이다. 1층과 2층  그리고 야외 카바나석과 야외베드석을 배치하여 운영 중이다. 침대를 의자 대신 사용하고  대나무 그늘막  라탄 가구 등으로 야외 테이블이 꾸며져 있어 이국적인 느낌이 가득하다. 
브라보비치에는 다양한 디저트들이 준비되어 있는데  그중 하루 100개만 한정 판매하는 브라보버거와 1인 3개 한정 판매하는 약과쿠기가 인기가 많다. 버터로 바삭하게 구워낸 소금빵과 꾸덕하고 달콤한 버터바  수제로 만든 제주당근케이크 등도 판매하고 있다.",064-782-8448,,,가능,0,,09:00~19:00<br>라스트오더 18:30,연중무휴,브라보 버거세트,브라보 버거세트 / 약과쿠키 / 소금빵 / 아이스크림크로플 / 제주당근케이크 외,,,가능,가능,가능(네이버 예약),"화장실:있음(남/녀 구분)
",20200624387
2837242,리보스코화덕피자 연동점,63141,,,제주특별자치도 제주시 수목원길 27 ,33.4694748009,126.4878685946,리보스코화덕피자는 제주특별자치도 제주시 연동에 있는 화덕피자 맛집이다. 한라수목원 가는 길에 있어 찾기도 쉽다. 세계 최초로 제주 톳을 이용해 도우를 만들었으며 모든 피자는 톳도우를 사용한다. 대표 메뉴는 해녀톳도우치즈몬지락피자  해녀톳도우한라산용암피자  해녀톳도우루꼴라듬뿍피자가 있고 제주 흑돼지 돈가스  한라봉 에이드도 인기가 많다. 모든 재료는 제주산을 고집한다. 테이블이 7개뿐인 아담하고 조용한 매장으로 예약하고 방문하지 않으면 대기를 해야 한다. 주말에는 브레이크 타임이 없으며 피자를 포장할 경우 할인 가격으로 제공한다. 주변 여행지로 제주 원도심  한라수목원 등이 있다.,064-745-0904,,,가능,0,,11:00~21:00 (라스트오더 20:30 ),매주 월요일,해녀톳도우치즈몬지락피자,해녀톳도우한라산용암피자 / 해녀톳도우루꼴라듬뿍피자 / 제주흑돼지돈까스 / 수제한라봉에이드,,,,,,,20130628401
2837996,말고기연구소,63166,,,제주특별자치도 제주시 북성로 43 1층,33.5155924319,126.5201452985,"말고기연구소는 제주공항 근처 제주 구도심 삼동이동에 있다. 말고기에 대한 좋은 인식을 목표로 하는 말고기전문점으로 매장에는 테이블이 없고  도시락 테이크아웃 전문점이다. 말 육회 부각 초밥  말 불고기 부각 초밥  말고기 육즙 소시지는 말고기를 처음 먹는 사람도 부담 없이 먹을 수 있도록 독자적으로 개발한 메뉴로 100% 제주산 말고기를 사용하고 있다. 근처 여행지로는 동문재래시장  탑동공장  사라봉 등이 있다.  
※ 반려동물 동반 가능",064-758-8250,,,불가,0,,10:00~22:00,연중무휴,말 육회 부각 초밥,"말 불고기 부각 초밥, 말고기 육즙 소시지 , 말고기 육포",,,가능,가능,,,20220898630
2838044,몬스터살롱,63034,,,제주특별자치도 제주시 일주서로 6017 ,33.4482826209,126.3072431123,몬스터살롱은 제주 곽지해수욕장 입구 대로변에 위치한 수제 햄버거와 츄러스 맛집이다. 이곳의 대표메뉴는 육즙이 가득한 제주 한우로 만든 몬스터버거  흑돼지를 13시간 훈연하여 만든 풀드포크버거  스페인 정통의 맛인 50cm 츄러스  한라봉과 유자의 조합인 봉자주스이다. 식감과 소스의 맛을 좋아하면 제주한우버거를 추천하고  부드러운 식감과 담백한 맛을 좋아하는 사람들에게는 흑돼지풀드포크버거를 추천한다. 각 메뉴는 단품과 세트구성 중에 선택하여 먹을 수 있다.,064-799-5310,,,가능(협소),0,,10:00~19:00<br>브레이크타임 15:00~16:00<br>라스트오더 18:30,연중무휴,몬스터제주한우버거,몬스터제주한우버거 / 소다세트 / 몬스터흑돼지풀드포크 / 롱츄러스 외,,,가능,가능,,,20140627746
2838059,미엘드세화,63361,,,제주특별자치도 제주시 해맞이해안로 1464 ,33.5245497062,126.8618543076,미엘드세화는 제주특별자치도 제주시 구좌읍 세화리에 있는 디저트 카페다. 세화 항구와 세화해수욕장 앞에 있어 바다 뷰를 즐길 수 있다. 대표 메뉴는 꿀을 넣고 생크림을 올린 미엘 커피이고 구좌읍에서 생산된 당근으로 만든 주스와 케이크도 인기다. 제철 과일로 만드는 디저트와 케이크는 계절마다 달라지는데 망고 케이크  수박주스  무화과 케이크  초당 옥수수 코스트 등이 있다. 바다 바로 앞이라 전망이 좋고 가까운 곳에 해녀박물관  숨비소리길  비자림 등이 있다.,064-782-6070,,,없음 (세화 해수욕장 주차장 이용),0,,10:00~18:00,매주 수요일 (인스타그램 참조),미엘커피,미엘라테 / 아메리카노 / 당근주스 / 댕유지에이드 / 미엘밀크티 외,,,,,,,20140627129
2838100,스시애월,46294,,,부산광역시 금정구 장전로 57 (장전동) ,35.2296622336,129.0828210359,스시애월은 애월항 근처 바닷가에 있다. 일식 초밥  회 코스요리 전문점이며 예약제로 운영되고 있다. 시간 별로 예약된 사람만 바에 앉아 순서대로 나오는 회와 초밥  소바  튀김 등 코스요리를 즐길 수 있다. 참치 뱃살 등 고가의 초밥을 제공하는 것에 비해서는 가성비가 좋은 오마카세 집으로 알려져 있다. 노키즈 존이며 전화 예약만 가능하다. 주변 여행지로 고내봉  한담해변  고내리포구 등이 있다.,064-799-2008,,,있음 (소형 5대),0,,11:00 ~20:00<br>브레이크타임 16:00~17:00<br>라스트오더 19:00 <br>※ 예약제 운영 (전화),매주 수요일<br>※ 휴무일 인스타그램 별도 공지,사시미 앤 도로초밥세트,사시미 앤 도로초밥세트 단일메뉴,,,,,전화 예약제 운영,"부대시설:무선인터넷 
",20160627902
2839718,나비정원,63506,,,제주특별자치도 서귀포시 신영로 60-7 1호,33.2204763428,126.2492726682,제주 나비정원은 모슬포항과 대정오일장 근처에 있다 노부부가 운영하는 작고 빈티지한 커피점으로 매주 직접 선별하고 로스팅한 스페셜티 커피를 제공한다. 하와이안 코나  핸드드립 커피가 메인 메뉴이며 유기농 티를 비롯해 베트남  브라질  에티오피아 등 세계 각국의 커피 원두를 판매한다. 인근에 모슬포항  마라도  가파도로 가는 여객선 터미널이 있다.,064-792-2688,,,불가,0,,10:30~20:00,매주 수요일,핸드드립 커피,핸드드립 커피 / 유기농 티 / 제주 레몬 에이드 / 크림바나나 / 초콜렛밀크 등,,,,,,,20130631333
2839730,보래드베이커스,63599,,,제주특별자치도 서귀포시 보목로64번길 178 1층,33.2444429618,126.5905508715,보래드베이커스는 제주 서귀포 서귀항 근처에 있다. 서귀항과 문섬이 보이는 오션뷰 카페로 호텔서귀피안과 함께 운영되고 있다. 오전 8시에 오픈하여 호텔 투숙객이 아침 식사를 하기 좋다. 모든 베이커리 메뉴는 오전 8시부터 오전 11시까지 제공하고 저녁에는 바(Bar)로 운영한다. 생커피콩을 엄선하여 직접 볶는 로스터리 카페로 굿즈도 판매하고 있다. 근처에 정방폭포  외돌개 등이 있어 연계 관광에 수월하다.,064-735-1450,,,있음,0,,08:00~21:00 (라스트오더 20:30),연중무휴,플레인 크로아상,"테디밀크티, 페퍼로니피자, 생자몽착즙쥬스, 마틸다케이크 등",,,,,,,20190624554
2839771,롱로드,63024,,,제주특별자치도 제주시 귀덕3길 36 ,33.4411329714,126.2792373753,롱로드는 제주 서쪽 귀덕리 바닷가에 있다. 작고 소박한 외관과 아기자기한 인테리어가 특징이며 메인 메뉴는 매일 아침 신선한 재료로 만든 100% 수제 쇠고기 함박스테이크이다. 그 외 아보카도 함박스테이크  타코 라이스  치킨 가라아게 등도 맛볼 수 있다. 평일엔 오후 4시까지 영업하며 재료 소진 시 일찍 마감할 수도 있다. 근처에 곽지해수욕장  한림항 등이 있어 연계 관광이 수월하다.,064-796-4073,,,있음 (소형 약 6대),0,,"월,화,목,금 11:00~16:00  / 토,일 11:00~20:00",수요일,100% 비프 수제 함박스테이크,"아보카도 함박스테이크, 타코 라이스, 치킨 가라아게",,,,,,,20160627923
2839794,임성반점,63156,,,제주특별자치도 제주시 용화로 57-1 ,33.5095179388,126.509763006,임성반점은 제주공항  용담 해안도로 근처에 있는 노포이다. 메인 메뉴는 잘 불지 않는 쫄깃한 면발  해산물과 버섯으로 맛을 낸 고추짬뽕으로 제주도민들의 재방문율이 높은 도민 맛집이다. 채수 맛이 잘 우러난 깔끔한 국물로 2020년 서울 최우수 레스토랑으로 선정된 바 있다. 근처에 용두암  용담 해안도로  탑동 해변 등이 있다.,064-711-3322,,,없음,0,,10:50~20:30,일요일,고추 짬뽕,"간짜장, 짜장면, 탕수육, 잡탕밥 등",,,,,,,20200620654
2839903,피즈 노형,63083,,,제주특별자치도 제주시 노형10길 6 1층,33.483650847,126.4776191647,피즈노형은 제주 공항 근처 노형동에 있다. 애월 피즈버거의 노형점으로 정통 아메리칸식 수제 햄버거를 판매한다. 100% 소고기 수제 패티와 구운 양파  구운 파프리카  스위스 치즈 등을 사용하는 피즈버거가 대표메뉴이다. 모던한 인테리어와 티셔츠  컵  프래그런스 같은 굿즈도 판매한다. 근처 여행지로 이호테우해변  용두암해안도로  도두봉 등이 있다.,0507-1473-3253,,,불가,0,,"11:00~21:00 (15:00~16:00 브레이크타임, 20:30 라스트오더)",연중무휴,피즈버거,피즈버거 / 아메리칸버거 / 치즈갈릭감자튀김 / 더블버거 / 치즈버거 등,,,,,,,20210622887
